Reporting range=["Quarterly"],Select year=["2025"],Select quarter=["1"]
"ASIN title",ASIN,Category,"Impressions: Impressions","Impressions: Rating (Median)","Impressions: Price (Median)","Impressions: Same-Day Shipping Speed","Impressions: 1D-Shipping Speed","Impressions: 2D-Shipping Speed","Clicks: Clicks","Clicks: Click Rate (CTR)","Clicks: Price (Median)","Clicks: Same-Day Shipping Speed","Clicks: 1D-Shipping Speed","Clicks: 2D-Shipping Speed","Basket Adds: Basket Adds","Basket Adds: Price (Median)","Basket Adds: Same-Day Shipping Speed","Basket Adds: 1D-Shipping Speed","Basket Adds: 2D-Shipping Speed","Purchases: Purchases","Purchases: Search Traffic Sales","Purchases: Conversion Rate %","Purchases: Rating (Median)","Purchases: Price (Median)","Purchases: Same-Day Shipping Speed","Purchases: 1D-Shipping Speed","Purchases: 2D-Shipping Speed","Reporting Date"
"Neweleven Mothers Day Gifts for Mum - Mum Birthday Present from Daughter, Son, Kids, Husband - Best Birthday Presents for Wife, Mother, New Mummy, Wife - 12 Oz Tumbler","B07Y7ZQ265","Kitchen","363735",,"14.98","75972","256942","19201","2523","0.69","14.98","534","1774","128","797","14.98","172","551","47","264","3689.7","10.46",,"14.98","57","182","17","2025-03-31"
"NEWELEVEN Dad Gift from Daughter, Son, Kids, Wife - Birthday Gift for New Dad, Husband, Men - Best Present Idea for Father, Husband, Bonus Dad from Daughter, Son, Wife - 20 Oz Tumbler","B088GX79HT","Kitchen","23654",,"19.98","1845","15266","4377","137","0.58","15.98","10","97","21","55","15.98","5","39","7","18","291.64","13.14",,"15.98","2","14","2","2025-03-31"
"40th Birthday Gifts For Women - 1982 40th Birthday Decorations For Women - Gifts For Women Turning 40 - 40 Year Old Birthday Gifts For Mom, Wife, Sisters - Wine Tumbler","B089QFK8NV","Home","14",,"26.7","0","0","0","0","0.0",,"0","0","0","0",,"0","0","0","0","0.0",,,,"0","0","0","2025-03-31"
"Aprons For Men With Pockets - Christmas Gifts - Gifts For Men, Dad - Birthday Gifts for Men, Dad, Husband, Boyfriend, Him - Grill Cooking BBQ Kitchen Chef Apron","B08CDFWN1Q","Apparel","98",,"26.4","0","0","0","0","0.0",,"0","0","0","0",,"0","0","0","0","0.0",,,,"0","0","0","2025-03-31"
"NewEleven 60th Birthday Wine Tumbler - 12 oz Pink Insulated Stainless Steel Tumbler with Lid, Straw, Straw Cleaning Brush - Perfect for Women, Mom, Wife, Sisters, Friends - 1 Count (Pack of 1)","B08R8PXYL6","Kitchen","162",,"36.49","0","0","0","1","0.62","36.16","0","0","0","0",,"0","0","0","0","0.0","0.0",,,"0","0","0","2025-03-31"
"40th Birthday Gifts For Men, Women - 1983 40th Birthday Decorations For Men, Women - Gifts for Women Turning 40 - 40 Year Old Gifts For Men, Him, Her, Husband, Wife - 20 Oz Tumbler","B08R8R2LQF","Kitchen","148591",,"17.98","8874","108329","17441","1106","0.74","17.98","72","770","134","447","17.98","33","315","63","126","2299.48","11.39",,"17.98","11","97","12","2025-03-31"
"NEWELEVEN Bridal Shower Gifts - Wedding Gifts for Bride - Bride to Be, Bachelorette Gifts, Engagement Gifts for Women - Bride Gifts for Bride to Be, Fiancee, Wifey, Her - 12 Oz Tumbler","B08R8R7T36","Kitchen","117973",,"17.98","9924","84087","14344","639","0.54","17.98","60","442","80","257","17.98","26","174","32","56","978.88","8.76",,"17.98","8","42","3","2025-03-31"
"NewEleven 50th Birthday Gifts for Men, Women - 1974 50th Birthday Decorations for Men, Women - Gifts for Women Turning 50-50 Year Old Gifts for Men, Dad, Mom, Husband, Wife - 20 Oz Tumbler","B08R8SW1NM","Kitchen","59",,"22.98","0","0","0","0","0.0",,"0","0","0","0",,"0","0","0","0","0.0",,,,"0","0","0","2025-03-31"
"Gifts For Mum From Daughter, Son - Birthday Gifts For Mum - Mothers Day Gifts For Mum, Wife, Women - Funny Birthday Presents From Daughter, Son, Husband - 20 0z Tumbler","B08ZKX6YK9","Kitchen","148",,"55.65","0","0","0","0","0.0",,"0","0","0","0",,"0","0","0","0","0.0",,,,"0","0","0","2025-03-31"
"NEWELEVEN Birthday Gifts from Daughter, Son, Kids, Wife - Birthday Gifts for New Dad, Husband, Men - Best Present Idea for Father, Husband, Bonus Dad from Daughter, Son, Wife - 20 Oz Tumbler","B08ZKZ1FJK","Kitchen","62128",,"17.98","4839","42718","9275","306","0.49","17.98","16","207","47","83","17.98","6","57","11","24","423.52","7.84",,"17.98","1","21","2","2025-03-31"
"NewEleven Retirement Gifts for Women 2024 - Birthday Gifts for Women Best Friend - Friendship Gifts - Colleagues Leaving Gifts, Farewell Gifts, Goodbye Gift for Women - 12Oz Wine Tumbler","B08ZRWW1W4","Kitchen","376",,"37.05","0","0","0","0","0.0",,"0","0","0","0",,"0","0","0","0","0.0",,,,"0","0","0","2025-03-31"
"NewEleven Valentines Gifts For Men, Dad, Husband, Him - Aprons For Men With Pockets - Funny Gifts For Men, Dad, Husband, Boyfriend, Him, Brother, Uncle - Grill Cooking BBQ Kitchen Chef Apron","B08ZYGT8SH","Apparel","8",,"28.94","0","0","0","0","0.0",,"0","0","0","0",,"0","0","0","0","0.0",,,,"0","0","0","2025-03-31"
"Retirement Gifts For Women 2021 - Retired Gifts For Women - Female Retirement Gifts - Coworker Leaving Gifts, Farewell Gifts, Goodbye Gift For Women, Colleagues, Coworkers, Friends - 20 Oz Tumble","B095S16WV3","Kitchen","5",,"29.49","0","0","0","0","0.0",,"0","0","0","0",,"0","0","0","0","0.0",,,,"0","0","0","2025-03-31"
"NewEleven Birthday Gifts for Brother - Funny Brother Gifts from Sister, Brother - Birthday Gifts for Him, Brother, Big Brother - Presents for Brothers from Sisters - 20Oz Tumbler","B09792XF8F","Kitchen","42804",,"17.98","4146","31381","4601","270","0.63","17.98","24","209","19","78","17.98","9","59","5","29","557.38","10.74",,"17.98","4","20","1","2025-03-31"
"Gifts For Dad From Daughter, Son, Kids - Birthday Gifts For Dad - Gifts For Husband, Men - Best Dad Bday Present Idea For Father, Bonus Dad, Men, Him From Daughter, Son, Wife - 20 Oz Tumbler","B097B9SY89","Kitchen","4",,"25.03","0","0","0","0","0.0",,"0","0","0","0",,"0","0","0","0","0.0",,,,"0","0","0","2025-03-31"
"NewEleven Birthday Gifts for Uncle - Best Uncle Ever Gifts - Funny Uncle Gifts from Niece, Nephew - Uncle Birthday Gifts - Best Gifts for New Uncle, Funcle, Uncle Announcement - 20 Oz Tumbler","B097H6PJCN","Kitchen","5259",,"17.98","425","3652","818","41","0.78","17.98","2","28","9","10","17.98","1","4","3","3","53.94","7.32",,"17.98","1","2","0","2025-03-31"
"NEWELEVEN Bride to Be Gifts for Her - Wedding Gifts for Bride - Bridal Shower Gift, Bachelorette Gifts for Bride - Engagement Gifts for Women - Bridal Gifts for Bride to Be, Fiancee - 20 Oz Tumbler","B09B9PKM9M","Kitchen","98098",,"18.98","7095","73233","12055","702","0.72","18.98","60","530","65","291","18.98","27","211","28","64","1173.72","9.12",,"18.98","7","42","7","2025-03-31"
"NEWELEVEN Bird Watching Gifts, Gifts For Bird Lovers - Bird Lovers Gifts For Men Women - Funny Birding Gifts For Birders, Bird Watchers, Bird Lovers, Men, Women, Friends - 20 Oz Tumbler","B09S9PGL4T","Kitchen","5",,"41.99","0","0","0","0","0.0",,"0","0","0","0",,"0","0","0","0","0.0",,,,"0","0","0","2025-03-31"
"NewEleven Birthday Gifts for Women, Friends - Birthday Gifts for Women – Female Friendship Gifts for Women - Best Presents for Mom, Her, BFF, Bestie - 20 Oz Tumbler","B09TT1GGMM","Kitchen","314",,"14.98","5","178","100","5","1.59","14.98","0","3","1","1","14.98","0","1","0","0","0.0","0.0",,,"0","0","0","2025-03-31"
"NewEleven Leaving Gifts for Colleagues Women Men - Good Luck, New Job Gifts, Leaving Presents for Colleagues - Funny, Sorry Your Leaving Gifts for Colleagues, Boss, Friends - 20 Oz Tumbler","B09XDFF8FF","Kitchen","109213",,"17.98","16977","82687","6172","1822","1.67","17.98","264","1370","117","297","17.98","45","226","19","111","2037.78","6.09",,"17.98","23","79","7","2025-03-31"
"Retirement Gifts For Women 2022 - Retired Gifts For Women - Female Retirement Gifts - Coworker Leaving Gifts, Farewell Gifts, Goodbye Gift For Women, Colleagues, Coworkers, Friends - 20 Oz Tumbler","B09XDFLNR8","Kitchen","1",,"33.64","0","0","0","0","0.0",,"0","0","0","0",,"0","0","0","0","0.0",,,,"0","0","0","2025-03-31"
"NewEleven Retirement Gifts For Women 2024 - Happy Retirement Gifts - Coworker Leaving Gifts, Farewell Gifts, Goodbye Gifts For Coworkers, Friends - 12 Oz Tumbler","B0B2WGL9ZW","Kitchen","2",,"33.47","0","0","0","0","0.0",,"0","0","0","0",,"0","0","0","0","0.0",,,,"0","0","0","2025-03-31"
"NEWELEVEN Leaving Gifts for Colleagues Women Men - Good Luck, New Job Gifts Leaving Presents for Colleagues - Funny, Sorry Your Leaving Gift for Coworkers, Colleague, Boss - 20 Oz Tumbler","B0B3J9CRB6","Kitchen","90927",,"16.98","10849","66263","9372","1236","1.36","16.98","161","907","107","374","16.98","56","276","26","140","2402.18","11.33",,"16.98","19","103","12","2025-03-31"
"NewEleven Retirement Gifts For Women 2024 - Happy Retirement Gifts - Coworker Leaving Gifts, Farewell Gifts, Goodbye Gifts For Coworkers, Friends - 12 Oz Tumbler","B0B9RLH8RV","Kitchen","3",,"33.64","0","0","0","0","0.0",,"0","0","0","0",,"0","0","0","0","0.0",,,,"0","0","0","2025-03-31"
"Gifts For Mom From Daughter, Son, Kids - Birthday Gifts For Mom - Best Bday Presents For Mom, Mother, Wife, New Mom, Bonus Mom, Mother In Law, Mama From Daughter, Son, Husband - 16 Oz Coffee Glass","B0B9SF2R4R","Kitchen","2",,"28.58","0","0","0","0","0.0",,"0","0","0","0",,"0","0","0","0","0.0",,,,"0","0","0","2025-03-31"
"NewEleven Christmas Gifts For Women Friendship - Funny Gifts For Friends Female - Unique Friendship Gifts For Women, Friend, Female, Bestie, Bff, Soul Sister, Work Bestie - 16 Oz Coffee Glass","B0BRCDZRSP","Kitchen","3",,"28.71","0","0","0","0","0.0",,"0","0","0","0",,"0","0","0","0","0.0",,,,"0","0","0","2025-03-31"
"NewEleven Gifts For Aunt From Niece, Nephew - Cool Gifts For Aunt, New Aunt, Auntie, Sister - Aunt Birthday Gift, Aunt Announcement, Promoted To Aunt, Best Aunt Ever - 16 Oz Coffee Glass","B0BYCT1SRJ","Kitchen","5",,"145.89","0","0","0","0","0.0",,"0","0","0","0",,"0","0","0","0","0.0",,,,"0","0","0","2025-03-31"
"NEWELEVEN Gifts For Women, Her - Daily Reminder, Mental Health Gifts - Inspirational Gifts For Women, Best Friend, Sister, Mom, Wife, Aunt, Her, Daughter, Coworker - 16 Oz Coffee Glass","B0BYDBPSBQ","Kitchen","20",,"19.99","0","0","0","0","0.0",,"0","0","0","0",,"0","0","0","0","0.0",,,,"0","0","0","2025-03-31"
"40th Birthday Gifts for Men Women - Vintage 1983 40th Birthday Decorations for Men Women - 40 Year Old Gifts for Men, Black, One size","B0C6DL59L9","Apparel","4",,"31.38","0","0","0","0","0.0",,"0","0","0","0",,"0","0","0","0","0.0",,,,"0","0","0","2025-03-31"
"Coworker Leaving Gifts - Farewell Gifts, Going Away Gift For Coworker - New Job, Goodbye, Good Luck Gifts For Coworkers, Colleagues, Boss, Work Bestie, Women, Friends - 16 Oz Coffee Glass","B0C9C2TTSR","Kitchen","9",,"90.4","0","0","0","0","0.0",,"0","0","0","0",,"0","0","0","0","0.0",,,,"0","0","0","2025-03-31"
"NewEleven Fathers Day Gift from Daughter, Son, Kids, Wife - Birthday Gifts for New Dad, Husband, Men - Best Present Idea for Father, Husband, Bonus Dad from Daughter, Son, Wife - 20 Oz Tumbler","B0CDLQGPKC","Kitchen","99350",,"14.99","8964","75599","8741","577","0.58","14.99","38","454","52","237","14.99","14","196","17","69","903.27","11.96",,"14.99","6","57","4","2025-03-31"
"NEWELEVEN Coworker Leaving Gifts - Farewell Gifts, Going Away Gift For Coworker - New Job Gifts, Goodbye Gifts, Good Luck Gifts For Coworkers, Friends, Boss, Men, Women - 20 Oz Tumbler (Navy)","B0CDLSGXDY","Kitchen","204",,"26.6","0","0","0","1","0.49","26.6","0","0","0","0",,"0","0","0","0","0.0","0.0",,,"0","0","0","2025-03-31"
"NewEleven Mothers Day Gifts For Wife From Husband - Romantic Anniversary Wedding Gifts For Wife, Her From Husband - Best Presents Idea For Wife, Women - 20 Oz Tumbler","B0CHFDJGN6","Kitchen","6",,"96.86","0","0","0","0","0.0",,"0","0","0","0",,"0","0","0","0","0.0",,,,"0","0","0","2025-03-31"
"Gifts For Mom - Birthday Gifts For Mom From Daughter, Son, Kids - Unique Present for New Mom Tote Bag, Cool Aunt Club White, One Size","B0CJLGYNFX","Shoes","1",,"40.89","0","0","0","0","0.0",,"0","0","0","0",,"0","0","0","0","0.0",,,,"0","0","0","2025-03-31"
"NEWELEVEN Gifts For New Mom 2024 – Pregnancy Gifts For First Time Mom, Pregnant Mom, Expecting Mom, Mom To Be, Mommy To Be - 16 Oz Coffee Glass","B0CKYKPBNV","Kitchen","66",,"24.97","0","0","0","0","0.0",,"0","0","0","0",,"0","0","0","0","0.0",,,,"0","0","0","2025-03-31"
"NEWELEVEN Christmas Gifts Book Lovers Book Lovers Gifts Women Her Friends Bookshelf Cup Book Accessories Bookish Gifts Writers Readers Librarian Bookaholic Bookworm – 16 Oz Coffee Glass","B0CKYMNV39","Kitchen","34",,"20.77","0","0","0","1","2.94","19.91","0","0","0","0",,"0","0","0","0","0.0","0.0",,,"0","0","0","2025-03-31"
"NewEleven Fathers Day Gift For Dad - Birthday Gifts For Dad From Daughter - Husband Gifts - Unique Birthday Present Ideas For Father, Husband, New Papa, Bonus Father From Daughter - 20 Oz Tumbler","B0CM5R5BDX","Kitchen","56",,"25.02","0","0","0","0","0.0",,"0","0","0","0",,"0","0","0","0","0.0",,,,"0","0","0","2025-03-31"
"NewEleven Fathers Day Gift For Dad - Birthday Gifts For Dad From Daughter - Husband Gifts - Unique Birthday Present Ideas For Father, Husband, New Papa, Bonus Father From Daughter - 20 Oz Tumbler","B0CM5RY3QS","Kitchen","17",,"24.98","0","0","0","1","5.88","25.32","0","0","0","0",,"0","0","0","0","0.0","0.0",,,"0","0","0","2025-03-31"
"NewEleven 60th Birthday Gifts - 1964 Decorations - 60 Year Old Gifts For Men, Women, Mom, Dad, Wife, Husband - 20 Oz Tumbler","B0CN8ZP46N","Kitchen","8015",,"13.98","145","4102","2425","59","0.74","13.98","2","27","18","12","13.98","0","7","3","2","27.96","3.39",,"13.98","0","1","1","2025-03-31"
"50th Birthday Gifts For Men Women - 1974 50th Birthday Decorations For Men Women - Gifts For Men Women Turning 50 - 50 Year Old Gifts For Men, Women, Mom, Dad, Wife, Husband - 20 Oz Tumbler Black","B0CN93621G","Kitchen","15",,"27.5","0","0","0","0","0.0",,"0","0","0","0",,"0","0","0","0","0.0",,,,"0","0","0","2025-03-31"
"NewEleven 50th Birthday Gifts For Men Women - 1974 50th Birthday Decorations - Gifts For Men Women Turning 50-50 Year Old Gift For Man, Woman, Mom, Dad, Wife, Husband - 20 Oz Tumbler","B0CN93LZ5M","Kitchen","4346",,"13.98","13","880","418","38","0.87","13.98","0","7","7","13","13.98","0","4","1","5","69.9","13.16",,"13.98","0","2","1","2025-03-31"
"NEWELEVEN Gifts from Daughter, Son, Kids, Wife - Birthday Gifts for New Dad, Husband, Men - Best Present Idea for Father, Husband, Bonus Dad from Daughter, Son, Wife - 20 Oz Tumbler","B0CQ2HR9WG","Kitchen","199948",,"17.98","13402","136135","36316","2135","1.07","17.98","144","1453","397","511","17.98","44","346","97","165","2967.7","7.73",,"17.98","15","114","33","2025-03-31"
"NEWELEVEN Gifts for Auntie - Auntie Birthday Present - Aunt Gift for Auntie from Niece, Nephew - Best Presents for Special Aunt, Auntie Mug, Aunty Gift - 16 Oz Coffee Glass","B0CQK1NB66","Kitchen","154273",,"14.98","22063","112262","13768","1366","0.89","14.98","185","997","132","750","14.98","105","543","72","244","3749.04","17.86",,"14.98","39","172","25","2025-03-31"
"Mothers Day Gifts For Mum - Gifts For Mum From Daughter, Son, Kids - Mothers Day Gifts For Mum, Her, Women, Wife - Best Birthday Presents For Mum, Mother, New Mum, Pregnant Mum - 16 Oz Coffee Glass","B0CQK1SY2M","Kitchen","22242",,"15.98","59","10417","9387","157","0.71","15.98","0","73","68","89","15.98","0","50","31","11","175.78","7.01",,"15.98","0","6","5","2025-03-31"
"NEWELEVEN Mothers Day Gifts for Mum - Birthday Present for Mum, Wife from Daughter, Son, Kids, Husband - Unique Birthday Gift for Mummy, Mother, Wife, Mom - 20 Oz Tumbler","B0CQLL3M3G","Kitchen","119724",,"15.98","15338","87709","10646","1169","0.98","15.98","160","856","99","269","15.98","36","201","23","90","1304.16","7.7",,"14.98","13","73","3","2025-03-31"
"NEWELEVEN Mothers Day Gifts for Mum - Mum Birthday Present from Daughter, Son, Kids, Husband - Best Birthday Presents for Wife, Mother, New Mummy, Wife - 20 Oz Tumbler","B0CRDKX5NB","Kitchen","5510",,"16.98","59","2849","2037","51","0.93","16.98","0","22","25","12","16.98","0","8","3","4","67.92","7.84",,"16.98","0","2","1","2025-03-31"
"NEWELEVEN Gifts For Mom, New Mom - Gifts For a Mom of Boys, Pregnant Mom, Expecting Mom, Mama, Mom To Be, Mommy To Be - 16 Oz Coffee Glass","B0CRVTN11L","Kitchen","54",,"31.38","0","0","0","0","0.0",,"0","0","0","0",,"0","0","0","0","0.0",,,,"0","0","0","2025-03-31"
"NewEleven Friendship Gifts for Women Friends, Best Friend Gift For Women, Birthday Gifts For Women Friendship, Friends, Female, Best Friend, Bestie, BFF - 16 Oz Coffee Glass","B0CW9PRMCJ","Kitchen","33",,"20.82","0","0","0","1","3.03","20.82","0","0","0","0",,"0","0","0","0","0.0","0.0",,,"0","0","0","2025-03-31"
"NEWELEVEN Gifts For Grandpa - Grandpa Birthday Gifts From Granddaughter, Grandson - Unique Birthday Present Ideas For Grandfather, New Grandpa, Promoted To Grandpa - 14 Oz Tumbler Navy","B0CXXCSPC2","Kitchen","13",,"25.46","0","0","0","0","0.0",,"0","0","0","0",,"0","0","0","0","0.0",,,,"0","0","0","2025-03-31"
"NEWELEVEN Gifts For Dad, Men - Funny Birthday Gifts For Dad, Husband - Present Idea For Father, New Dad, Papa, Bonus Dad, Husband, Uncle, Guys From Daughter, Son, Kids, Wife - 14 Oz Tumbler","B0CXXG46HR","Kitchen","31",,"26.46","0","0","0","0","0.0",,"0","0","0","0",,"0","0","0","0","0.0",,,,"0","0","0","2025-03-31"
"NewEleven Gifts For Wife From Husband - Wife Gifts - Wedding Anniversary Present For Wife, Her From Husband - Best Birthday Gifts For Wife, Women From Husband - 16 Oz Coffee Glass","B0D4QDCBRF","Kitchen","41",,"17.09","0","0","0","0","0.0",,"0","0","0","0",,"0","0","0","0","0.0",,,,"0","0","0","2025-03-31"
"NewEleven Bridal Shower Gifts - Wedding Gifts For Bride, Her - Bride To Be, Bachelorette Gifts, Engagement Gifts For Women - Bride Gifts For Bride To Be, Fiancee, Wifey, Her - 20 Oz Tumbler","B0D4QG5X87","Kitchen","21",,"23.47","0","0","0","0","0.0",,"0","0","0","0",,"0","0","0","0","0.0",,,,"0","0","0","2025-03-31"
"Housewarming Gift, New Home Gifts for Home Decor - New Home Ornament 2023, House Warming Presents for New Home Funny, Housewarming Gifts for New House, New Homeowner Ornament","B0D6144Q48","Home","2",,,"0","0","0","0","0.0",,"0","0","0","0",,"0","0","0","0","0.0",,,,"0","0","0","2025-03-31"
"NewEleven House Warming Gifts New Home - New Home Gift Ideas, Best Housewarming Gifts 2024, Housewarming Gifts New Home - Welcome Home Gifts for Homeowners, First Home Gifts - New Home Candle","B0D6GGZ5TL","Home","101",,"82.94","0","0","0","0","0.0",,"0","0","0","0",,"0","0","0","0","0.0",,,,"0","0","0","2025-03-31"
"NewEleven Pregnancy Announcement for Husband Wife Family, Gender Reveal Gifts, Pregnancy Gifts for Expecting Mom, Gifts for New Mom, New Dad, Mom to Be, New Parents - Ornament","B0D72Z4996","Home","29",,,"0","0","0","0","0.0",,"0","0","0","0",,"0","0","0","0","0.0",,,,"0","0","0","2025-03-31"
"NewEleven Nativity Ornament, Nativity Scene Ceramic Ornaments for Christmas Tree, Religious Gift for Christians, Women, Friends, and Family","B0D7MXCGWM","Home","18",,,"0","0","0","0","0.0",,"0","0","0","0",,"0","0","0","0","0.0",,,,"0","0","0","2025-03-31"
"Coworker Leaving Gifts - Farewell Gifts, Going Away Gift for Coworker - New Job, Goodbye, Good Luck Gifts for Coworkers, Colleagues, Boss, Men, Women, Friends - Candle Gifts","B0D831XY4Y","Home","37",,,"0","0","0","0","0.0",,"0","0","0","0",,"0","0","0","0","0.0",,,,"0","0","0","2025-03-31"
"NewEleven Glass Ornament - Coworker Appreciation Gift, Christmas Tree Decoration, Red Glass Round Colleague Ornament","B0DG8Y15PG","Home","17520",,"9.98","2560","13379","704","189","1.08","5.99","31","140","10","51","5.99","9","34","6","10","83.84","5.29",,"9.98","2","6","1","2025-03-31"
"NewEleven 40th Birthday Gifts For Men Women - 1985 40th Birthday Decorations For Men Women - Turning 40-40 Year Old Gifts For Man, Woman, Mom, Dad, Wife, Husband - 20 Oz Tumbler","B0DH7PQ1RX","Kitchen","58995",,"17.98","8077","41845","5000","381","0.65","17.98","42","280","26","124","17.98","14","91","7","24","419.52","6.3",,"17.98","2","21","0","2025-03-31"
"NewEleven 2024 Christmas Ornament, 2024 Year in Review Christmas Tree Ornaments, Memorable 2024 Christmas Decor Gifts, Decorative Gifts for Friends, Coworker, Family - Ceramic Christmas Ornaments","B0DH7VZ4CY","Home","10",,,"0","0","0","0","0.0",,"0","0","0","0",,"0","0","0","0","0.0",,,,"0","0","0","2025-03-31"
"NewEleven 50th Birthday Gifts For Women - 1975 50th Birthday Decorations For Women - Gifts For Her Turning 50 Year Old - 20 Oz Tumbler","B0DH7X6R1J","Kitchen","44682",,"15.98","13179","28095","1877","400","0.9","15.98","123","253","15","115","15.98","34","77","2","35","595.26","8.75",,"15.98","11","23","1","2025-03-31"
"NewEleven 50th Birthday Tumbler - 20oz Stainless Steel - Navy - Reusable - Leak-proof - Break Resistant - Double Wall Insulated for Men, Women, Mom, Dad, Wife, Husband - 1975 Birthday Decorations","B0DH7YGD9Q","Kitchen","116953",,"18.98","15874","83804","9771","922","0.79","18.98","127","647","72","352","18.98","49","255","21","130","2452.38","14.1",,"18.98","17","96","5","2025-03-31"
"NewEleven 60th Birthday Gifts For Men Women - 1965 60th Birthday Decorations For Him Her - Turning 60 Year Old Gifts For Man, Woman, Mom, Dad, Wife, Husband - 20 Oz Tumbler","B0DHCFTYVW","Kitchen","94780",,"17.98","13513","69865","6255","712","0.75","16.98","97","538","48","242","16.98","33","188","13","90","1558.18","12.64",,"16.98","15","69","3","2025-03-31"
"NewEleven House Warming Gifts New Home, New Home Ornament 2024, New Home Gift Ideas Decor- Welcome Home Gifts, Housewarming Gifts New Home, Best Housewarming Gifts 2024 - Glass Ornament","B0DHRKRSXC","Home","14",,,"0","0","0","0","0.0",,"0","0","0","0",,"0","0","0","0","0.0",,,,"0","0","0","2025-03-31"
"NewEleven Baby Pregnancy Announcement Ornament for Grandparents - First Time Grandparents Gifts - Promoted to Grandma Grandpa Gifts- Pregnancy Announcement Ornament - Glass Christmas Ornament","B0DJBGMLS2","Home","9",,,"0","0","0","0","0.0",,"0","0","0","0",,"0","0","0","0","0.0",,,,"0","0","0","2025-03-31"
"NewEleven My First Christmas, Baby First Christmas Ornament 2024, Baby Picture Frame for New Parents Gifts, Babys First Christmas Ornament 2024 Girl Boy - New Baby Double Sided Picture Frame Ornament","B0DJT47X1F","Home","13",,,"0","0","0","0","0.0",,"0","0","0","0",,"0","0","0","0","0.0",,,,"0","0","0","2025-03-31"
"NewEleven Coworker Ornaments, Christmas Ornaments Gifts for Coworkers - Coworkers Gifts for Women, Funny Gifts for Coworkers, Friendship Gifts for Work Bestie - Christmas Decorations","B0DJXTHGW2","Home","3",,,"0","0","0","0","0.0",,"0","0","0","0",,"0","0","0","0","0.0",,,,"0","0","0","2025-03-31"
"NewEleven Sister 2024, Sister Birthday Gifts for Women, Big Sister Gifts for Girls - Gift for Women, Soul Sister, BFF, Big Sister Gift Glass Christmas Ornaments","B0DJXZ36VG","Home","19",,,"0","0","0","0","0.0",,"0","0","0","0",,"0","0","0","0","0.0",,,,"0","0","0","2025-03-31"
"NewEleven Christmas Book Lovers Gifts, Bookshelf Decor Gifts for Book Lovers Women, Bookish Gifts, Book Club Gifts for Readers, Librarian Gifts - Bookish Items Decor, Book Ornament for Christmas Tree","B0DJY12521","Home","18",,,"0","0","0","0","0.0",,"0","0","0","0",,"0","0","0","0","0.0",,,,"0","0","0","2025-03-31"
"NewEleven Family Christmas Ornaments 2024, Christmas Decorations Indoor, Mom, Dad, Sister, Brother - Family Tree Funny Christmas Ornaments, Christmas Decor - Ceramic Christmas Ornaments","B0DJY14TYV","Home","4",,,"0","0","0","0","0.0",,"0","0","0","0",,"0","0","0","0","0.0",,,,"0","0","0","2025-03-31"
"NewEleven Thank You Gifts for Women, Friends, BFF, Coworker for Women, Appreciation Gifts for Women - Gift for Women, Best Friend Birthday Gifts - Glass Christmas Ornament 2024","B0DJY2BVJB","Home","25",,"61.74","0","0","0","2","8.0","40.18","0","0","0","0",,"0","0","0","0","0.0","0.0",,,"0","0","0","2025-03-31"
"NewEleven Engagement Gifts for Couples 2024 - First Christmas Engaged Gifts for Her, Engagement Gift for Engaged Couples, Engagement Gifts for Her, Bride to Be Gifts, Glass Christmas Ornaments","B0DJY3RDHV","Home","8",,,"0","0","0","0","0.0",,"0","0","0","0",,"0","0","0","0","0.0",,,,"0","0","0","2025-03-31"
"NewEleven Gifts for Mom from Daughter, Daughter Gifts from Mom, for Mom, Mom Gifts, Birthday Gifts for Mom, Mother Gifts - The Love Between Mother and Daughter - Christmas Ornaments","B0DJY5ZSY9","Home","11",,"35.05","0","0","0","2","18.18","35.05","0","0","0","0",,"0","0","0","0","0.0","0.0",,,"0","0","0","2025-03-31"
"NewEleven Book Lovers Gifts, Book Ornament Gifts for Book Lovers, Bookish Gifts for Readers, Book Club Gifts for Women Bookworm Librarian, Nerd Gifts - Book Tree Ornament, Glass Christmas Ornaments","B0DJY74MRC","Home","5",,,"0","0","0","0","0.0",,"0","0","0","0",,"0","0","0","0","0.0",,,,"0","0","0","2025-03-31"
"NewEleven Pet First Christmas Ornaments 2024, My First Christmas Ornament Gifts for Puppy Dog Cat Pet Lovers, Cat Dog Picture Frame Ornaments for Christmas Tree, Photo Christmas Ornaments Decorations","B0DJY79JYZ","Home","11",,"29.22","0","0","0","2","18.18","29.22","0","0","0","0",,"0","0","0","0","0.0","0.0",,,"0","0","0","2025-03-31"
"NewEleven Godparents Proposal Gift - Godmother Proposal Gift - Godparents are Blessing, Godfather Gift - Godmother Gift, Gifts for Godparents, Baptism Decoration Gifts - Ceramic Christmas Ornaments","B0DJY87DG8","Home","8",,,"0","0","0","0","0.0",,"0","0","0","0",,"0","0","0","0","0.0",,,,"0","0","0","2025-03-31"
"NewEleven Godmother Proposal Gift - Godmother Gift - Will You be My Godmother - Godmother Gifts for Christmas, Godmother Gifts from Godchild, Godmother Gifts from Godchild - Christmas Ornament 2024","B0DJY9BWQ4","Home","8",,,"0","0","0","0","0.0",,"0","0","0","0",,"0","0","0","0","0.0",,,,"0","0","0","2025-03-31"
